{
  "schema": "HarborLanternInterchangeV1",
  "fixtureVersion": "1.0.0",
  "case": {
    "id": "harbor-lantern",
    "displayId": "HL-TRAIN-001",
    "title": "Harbor Lantern",
    "purpose": "training",
    "synthetic": true,
    "handlingLabel": "training",
    "question": "Did the group associated with Northstar Imports change structure before the March 18 shipment?",
    "scope": {
      "permittedStart": "2026-01-01T00:00:00Z",
      "permittedEnd": "2026-04-01T00:00:00Z",
      "beforeStart": "2026-01-18T00:00:00Z",
      "beforeEnd": "2026-02-17T00:00:00Z",
      "afterStart": "2026-02-17T00:00:00Z",
      "afterEnd": "2026-03-19T00:00:00Z",
      "knownAt": "2026-03-18T23:59:00Z"
    }
  },
  "guidedSteps": [
    {
      "id": "question",
      "label": "Understand the question",
      "eyebrow": "Step 1 of 7 · Frame the task",
      "title": "What changed before the shipment?",
      "explanation": "We are comparing two equal periods around one event. The question is about observed structure, not guilt or intent.",
      "task": "Review the scope and smart defaults, then continue."
    },
    {
      "id": "evidence",
      "label": "Review evidence",
      "eyebrow": "Step 2 of 7 · Check the ingredients",
      "title": "Open the claim behind a connection",
      "explanation": "A line is a sourced claim. Select a row or graph element to see when it happened, when analysts learned it, and what could weaken it.",
      "task": "Inspect the Elena Voss → Northstar relationship."
    },
    {
      "id": "compare",
      "label": "Compare periods",
      "eyebrow": "Step 3 of 7 · Keep your bearings",
      "title": "Compare like with like",
      "explanation": "The same entity stays in the same place in both panels. That makes additions and missing observations easier to notice without mistaking layout movement for real change.",
      "task": "Switch comparison modes and identify the highlighted change."
    },
    {
      "id": "community",
      "label": "Examine community change",
      "eyebrow": "Step 4 of 7 · Interpret the pattern",
      "title": "A possible split, not a verdict",
      "explanation": "A community is a pattern found under selected rules. It may reflect communication, finance, shared resources, or collection patterns. It is not proof of an organization or crime.",
      "task": "Read the change summary and the competing interpretation."
    },
    {
      "id": "alternatives",
      "label": "Test uncertainty",
      "eyebrow": "Step 5 of 7 · Try to disprove it",
      "title": "What if the alias is wrong?",
      "explanation": "Analytical choices create a new version. Visual styling does not. Test the disputed alias or a shorter window, compare the result, then reset if needed.",
      "task": "Turn off the disputed alias and observe what changes."
    },
    {
      "id": "finding",
      "label": "Save a finding",
      "eyebrow": "Step 6 of 7 · State only what is supported",
      "title": "Write a cautious assessment",
      "explanation": "A useful finding includes supporting and contrary evidence, assumptions, confidence, limitations, and a lawful next action.",
      "task": "Review the generated finding and mark it ready."
    },
    {
      "id": "report",
      "label": "Preview the report",
      "eyebrow": "Step 7 of 7 · Make it reconstructable",
      "title": "Check before sharing",
      "explanation": "The report records both time cutoffs, the analytical version, uncertainty, contrary evidence, and exact source dependencies.",
      "task": "Run preflight and export the training report."
    }
  ],
  "nodes": [
    { "id": "northstar", "label": "Northstar Imports", "type": "organization", "x": 50, "y": 48 },
    { "id": "elena", "label": "Elena Voss", "type": "person", "x": 25, "y": 25 },
    { "id": "marcus", "label": "Marcus Reed", "type": "person", "x": 76, "y": 22 },
    { "id": "dock7", "label": "Dock 7", "type": "place", "x": 83, "y": 67 },
    { "id": "halcyon", "label": "Halcyon Freight", "type": "organization", "x": 48, "y": 84 },
    { "id": "device", "label": "Device L-14", "type": "device", "x": 17, "y": 73 }
  ],
  "relationships": [
    {
      "id": "r1",
      "assertionId": "hl-employment",
      "revisionId": "hl-employment-r1",
      "subject": "elena",
      "predicate": "reported employed by",
      "predicateCode": "reported_employed_by",
      "object": "northstar",
      "relation": "employment",
      "periods": ["before", "after"],
      "evidenceClass": "source report",
      "assertionClass": "source_report",
      "confidence": "moderate",
      "confidenceValue": 0.68,
      "sourceId": "hl-source-port-roster",
      "source": "Port access roster HL-014",
      "originalReference": "HL-PORT-ROSTER-014#elena-voss",
      "eventTime": "2026-02-03",
      "knownAt": "2026-02-05",
      "validStart": "2026-01-18T00:00:00Z",
      "validEnd": "2026-03-19T00:00:00Z",
      "recordedStart": "2026-02-05T00:00:00Z",
      "recordedEnd": null,
      "reliability": "B · usually reliable",
      "credibility": "2 · probably true",
      "reasoning": "The roster names Elena Voss, but an unresolved alias may refer to a different Elena.",
      "caveat": "Identity disputed; excluding the alias lowers split confidence.",
      "communityBefore": "A",
      "communityAfter": "A1",
      "status": "uncertain",
      "handlingLabel": "training",
      "fieldRestrictions": []
    },
    {
      "id": "r2",
      "assertionId": "hl-communications",
      "revisionId": "hl-communications-r1",
      "subject": "northstar",
      "predicate": "communicated with",
      "predicateCode": "communicated_with",
      "object": "marcus",
      "relation": "communications",
      "periods": ["before", "after"],
      "evidenceClass": "source report",
      "assertionClass": "source_report",
      "confidence": "high",
      "confidenceValue": 0.88,
      "sourceId": "hl-source-call-detail",
      "source": "Authorized call-detail extract HL-021",
      "originalReference": "HL-CALL-DETAIL-021#northstar-marcus",
      "eventTime": "2026-02-12–2026-03-16",
      "knownAt": "2026-03-17",
      "validStart": "2026-02-12T00:00:00Z",
      "validEnd": "2026-03-17T00:00:00Z",
      "recordedStart": "2026-03-17T00:00:00Z",
      "recordedEnd": null,
      "reliability": "A · reliable",
      "credibility": "2 · probably true",
      "reasoning": "Repeated observed contacts cross both windows.",
      "caveat": "Contact does not establish purpose or content.",
      "communityBefore": "A",
      "communityAfter": "A1",
      "status": "observed",
      "handlingLabel": "training",
      "fieldRestrictions": []
    },
    {
      "id": "r3",
      "assertionId": "hl-dock-visit",
      "revisionId": "hl-dock-visit-r1",
      "subject": "marcus",
      "predicate": "visited",
      "predicateCode": "visited",
      "object": "dock7",
      "relation": "shipment",
      "periods": ["after"],
      "evidenceClass": "source report",
      "assertionClass": "observed_event",
      "confidence": "moderate",
      "confidenceValue": 0.72,
      "sourceId": "hl-source-gate-log",
      "source": "Gate log HL-033",
      "originalReference": "HL-GATE-LOG-033#2026-03-11",
      "eventTime": "2026-03-11",
      "eventAt": "2026-03-11T12:00:00Z",
      "eventPrecision": "day",
      "knownAt": "2026-03-12",
      "validStart": "2026-03-11T12:00:00Z",
      "validEnd": "2026-03-11T12:01:00Z",
      "recordedStart": "2026-03-12T00:00:00Z",
      "recordedEnd": null,
      "reliability": "B · usually reliable",
      "credibility": "2 · probably true",
      "reasoning": "A vehicle registered to Marcus entered Dock 7.",
      "caveat": "The log does not establish who was driving.",
      "communityBefore": "—",
      "communityAfter": "A1",
      "status": "appeared",
      "handlingLabel": "training",
      "fieldRestrictions": []
    },
    {
      "id": "r4",
      "assertionId": "hl-transfer",
      "revisionId": "hl-transfer-r1",
      "subject": "northstar",
      "predicate": "transferred funds to",
      "predicateCode": "transferred_funds_to",
      "object": "halcyon",
      "relation": "transfers",
      "periods": ["before"],
      "evidenceClass": "source report",
      "assertionClass": "observed_event",
      "confidence": "high",
      "confidenceValue": 0.96,
      "sourceId": "hl-source-financial",
      "source": "Financial record HL-008",
      "originalReference": "HL-FINANCIAL-008#2026-01-29",
      "eventTime": "2026-01-29",
      "eventAt": "2026-01-29T15:00:00Z",
      "eventPrecision": "day",
      "knownAt": "2026-02-02",
      "validStart": "2026-01-29T15:00:00Z",
      "validEnd": "2026-01-29T15:01:00Z",
      "recordedStart": "2026-02-02T00:00:00Z",
      "recordedEnd": null,
      "reliability": "A · reliable",
      "credibility": "1 · confirmed",
      "reasoning": "The transfer is directly documented in an authorized record.",
      "caveat": "No later transfer was observed; that is not proof the relationship ended.",
      "communityBefore": "A",
      "communityAfter": "A2",
      "status": "no-longer-observed",
      "handlingLabel": "training",
      "fieldRestrictions": []
    },
    {
      "id": "r5",
      "assertionId": "hl-device-association",
      "revisionId": "hl-device-association-r1",
      "subject": "elena",
      "predicate": "shared",
      "predicateCode": "shared_device",
      "object": "device",
      "relation": "devices",
      "periods": ["before", "after"],
      "evidenceClass": "analyst judgment",
      "assertionClass": "analyst_judgment",
      "confidence": "low",
      "confidenceValue": 0.42,
      "sourceId": "hl-source-analyst-correlation",
      "source": "Analyst correlation HL-A04",
      "originalReference": "HL-ANALYST-CORRELATION-A04",
      "eventTime": "2026-02-10–2026-03-09",
      "knownAt": "2026-03-15",
      "validStart": "2026-02-10T00:00:00Z",
      "validEnd": "2026-03-10T00:00:00Z",